[
  {
    "id": "f47ac10b-58cc-4372-a567-0e02b2c3d479",
    "title": "Запуск новой платформы для разработчиков",
    "preview": "Представляем инструменты для ускорения разработки",
    "tags": ["технологии", "запуск", "разработка"],
    "date": "2024-01-15T10:30:00Z",
    "url": "https://example.com/news/launch"
  }
]
